<?xml version="1.0"?>

<foo
    xmlns:dc="http://purl.org/dc/terms/"
    xmlns:xsd="http://www.w3.org/2001/XMLSchema"
    xmlns:xsi="http://www.w3.org/2001/XMLSchema-instance"
    xmlns:qux="http://qux.example.org"
    xsi:schemaLocation="http://foo.example.org foo.xsd http://www.w3.org/1999/xhtml/datatypes/ ../xsd/xhtml-datatypes-1.xsd">
  <bar xml:id="base64ToBinary" value="Zm9vCg=="/>
  <bar xml:id="curieToUri" value="dc:source"/>
  <bar xml:id="hexToBinary" value="1234abcdef"/>
  <bar xml:id="pairsToMap" value="foo bar baz-qux 42"/>
  <bar xml:id="resolveIdRef" value="toLang"/>
  <bar xml:id="safeCurieToUri" value="[qux:#1234]"/>
  <bar xml:id="toArray" value="foo   bar	baz"/>
  <bar xml:id="toBool.1" value="true"/>
  <bar xml:id="toBool.2" value="false"/>
  <bar xml:id="toDateTime" value="2021-02-16T18:04:03.123+00:00"/>
  <bar xml:id="toDocument" value="foo.xml"/>
  <bar xml:id="toDocumentOrElement" value="foo.xml#bar"/>
  <bar xml:id="toDuration" value="PT5M"/>
  <bar xml:id="toFloat" value="3.141"/>
  <bar xml:id="toInt" value="42"/>
  <bar xml:id="toIntSet" value="42 -42 0 7 5"/>
  <bar xml:id="toLang" value="yo-NG"/>
  <bar xml:id="toLiteral.1" value="Lorem ipsum"/>
  <bar xml:id="toLiteral.2" xml:lang="it" value="libertÃ "/>
  <bar
      xmlns="http://www.w3.org/1999/xhtml"
      xml:id="toLiteral.3"
      datatype="http://www.w3.org/2001/XMLSchema#date"
      value="2026-01-30"/>
  <bar
      xmlns="http://www.w3.org/1999/xhtml"
      xml:id="toLiteral.4"
      datatype="http://www.w3.org/2001/XMLSchema#boolean">true</bar>
  <bar xml:id="toMediaType" value="application/json"/>
  <bar xml:id="toNonNegativeRange" value="42-43"/>
  <bar xml:id="toSet" value="foo&#x0d;bar&#x0a;baz"/>
  <bar xml:id="toUri" value="http://www.example.org/foo"/>
  <bar xml:id="toXName" value="dc:title"/>
  <bar xml:id="uriOrSafeCurieToUri.1" value="http://www.example.biz/foo"/>
  <bar xml:id="uriOrSafeCurieToUri.2" value="[xsd:#token]"/>
  <bar xml:id="xhRelToUri" value="icon"/>
  <bar xml:id="xPointerUriToSubset" value="bar.xml#appinfo2"/>
  <baz
      xml:id="xPointerUriToValueSet"
      value="#xpointer(//@xml:id[starts-with^(., 'toD'^)])"/>
  <bar xml:id="yesNoToBool.1" value="yes"/>
  <bar xml:id="yesNoToBool.2" value="no"/>
  <bar xml:id="toRdfaDatatype.1" value="true"/>
  <bar
      xmlns="http://www.w3.org/1999/xhtml"
      xml:id="toRdfaDatatype.2"
      datatype="xsd:boolean"
      value="true"/>
  <bar
      xmlns="http://www.w3.org/1999/xhtml"
      xml:id="toRdfaDatatype.3"
      datatype="xsd:formChoice"
      value="qualified"
      prefix="**"/>
  <bar
      xmlns="http://www.w3.org/1999/xhtml"
      xmlns:foo-xsd="foo.xsd#"
      xml:id="toRdfaDatatype.4"
      datatype="foo-xsd:UpperString"
      value="Lorem ipsum."/>
  <bar
      xmlns="http://www.w3.org/1999/xhtml"
      xml:id="toRdfaDatatype.5"
      datatype="xsd:reducedDerivationControl"
      value="restriction"/>
  <bar
      xmlns="http://www.w3.org/1999/xhtml"
      xmlns:foo-xsd="foo.xsd#"
      xml:id="toRdfaDatatype.6"
      datatype="foo-xsd:SimpleList"
      value="foo bar baz"/>
  <bar
      xmlns="http://www.w3.org/1999/xhtml"
      xmlns:foo-xsd="foo.xsd#"
      xml:id="toRdfaDatatype.7"
      datatype="foo-xsd:ListOfEnum"
      value="BAZ BAR FOO"/>
  <bar
      xmlns="http://www.w3.org/1999/xhtml"
      xmlns:bar="https://bar.example.com"
      xmlns:foo-xsd="foo.xsd#"
      xmlns:rel="rel#"
      xml:id="toRdfaDatatype.8"
      datatype="foo-xsd:Curies"
      value="bar:#top rel:item"/>
  <bar
      xmlns="http://www.w3.org/1999/xhtml"
      xml:id="toRdfaDatatype-invalid"
      datatype="xsd:foo"
      value="bar"/>
</foo>
